,"debt ceiling negotiators make progress on spending, but still have 'major issues'",morgan stanley upgrades this  mining stock that can surge more than 20%,"ai is the latest buzzword in techbut before investing, know these 4 terms","ford's ev charging deal with tesla puts pressure on gm, other rival automakers",marvell shares soar 25% after the chip firm beats on top and bottom line results,"jpmorgan chase cut about 500 jobs this week, including technology and operations roles",dow jumps 300 points as wall street grows hopeful that a debt ceiling deal can be reached,nvidia shares jumped 25% this week  and got cheaper. here's how that happens,disney rips desantis bid to disqualify judge in free speech lawsuit,is there a 'right' age for kids to be on social media? here's what an expert says,investors shifted into these gold and small-cap etfs this week,vesting means it can take up to 6 years for workers to own their 401(k) match,a.i. excitement leads to a winning week for nvidia and other tech stocks,"despite all odds, consumers are still traveling this summer. how to play it",taylor swift to metallica: top 10 most in-demand artists of summer,companies are learning gen z isnt the easiest generation to work with,"club name ford teams up with tesla, sending shares soaring",paramount shares pop after bdt capital bets on the media giant's key shareholder,biden interior advances renewable energy transmission projects in nevada,"needham says this stock plays the 'almost perfect marriage' between a.i., crypto","30-year-old billionaire started with a website, sewing kit and pizza hut salary",why the pause on student loan payments has been a win for public servants,house passes bill blocking student debt forgivenesswhat borrowers need to know,jpmorgan ceo jamie dimon faces deposition in jeffrey epstein lawsuits,how virtual layoffs became the new normal for workplaces,bofa hits spacecraft builder terran orbital with rare double downgrade,heres why it might be time to buy longer-term bonds now,"jpmorgan chase cut about 500 jobs this week, including tech and operations roles",how this cmo got comfortable embracing his asian identity at work,facebook-giphy sale shows how fear of regulators is slowing m&a market,apple and nvidia are in my top 5 holdings. am i still diversified enough?,"stocks making the biggest moves midday: ford, marvell technology, gap and more","companies add, expand tuition assistance so workers can go back to college"
"stocks rally friday on hopes for a debt ceiling deal, nasdaq notches fifth straight week of wins",,,,,,,,,,,,,,,,,,,,,,,,,,,,,,,,,
"treasury says it could run out of money june 5, buying time for debt ceiling talks",next week hints at only short-lived debt deal relief as jobs report looms,"the tech trade is back, driven by a.i. craze and prospect of slowing fed hikes","the tech trade is back, driven by a.i. craze and prospect of a less aggressive fed","treasury now says it could run out of money june 5, buying time for debt ceiling talks",marvell shares soar 32% after the chip firm beats on top and bottom line results,,,,,,,,,,,,,,,,,,,,,,,,,,,,
top 10 cheapest places in the u.s. to buy a beach house,3 investing tips as the federal debt ceiling 'x-date' approaches,"lower-income consumers pay for wealthy's credit card rewards, some economists say",analysts are pounding the table for these must-own stocks ahead of summer,how janie deegan built janie's life-changing baked goods,chip stocks amd and nvidia are among the most overbought stocks on wall street,why commercial real estate firms are joining to recruit black student-athletes,how mastercard has outperformed visa,biden says he's 'very optimistic' about a debt ceiling deal,mark cuban calls elon musks twitter algorithm unfairhere's how he'd fix it,steve adcock: the 3 'stupidest' myths i've heard about early retirement,marvell technology shares surge after earnings beat. here's how to play it,microsoft keyboard users are devastated after discontinuation of accessories,japan stocks are on fire this year. why the rally could have 'staying power',,,,,,,,,,,,,,,,,,,,
"with emergency savings down and credit card balances up, these 3 steps may help","home price declines may be over, s&p case-shiller says","stocks making the biggest premarket moves: chargepoint, ford, nvidia and more","rbc raises year-end stock market forecast, sees buying opportunity in small caps","two club stocks get wall street upgrades, sending shares higher","china's disappointing rebound could bring in more stimulus, economists say",roth sees more than 20% upside for boston beer heading into summer,nvidia hits $1 trillion market cap,tesla shares rise as elon musk meets with china's foreign minister,debt ceiling bill faces a tough path in the house as gop opposition grows,memorial day air travel tops 2019 levels as consumers shell out for trips,debt ceiling deal would push student loan borrowers into repayment by fall,treasury yields stumble as investors anticipate debt ceiling deal vote,"cnbc daily open: next stop, congress",chart analysts see market correction coming after brief debt deal euphoria,"jefferies upgrades ford motor, says auto giant's stock can rally more than 30%","tuesday's biggest analyst calls: nvidia, tesla, ford, wayfair, coinbase, disney",we are trimming a couple of our tech stocks that have been riding the wave of ai,"chatgpt cited ""bogus"" cases for a new york federal court filing",theranos founder elizabeth holmes set to report to prison tuesday,cathie wood's ark invest misses out on nvidia's powerful rally,35-year-old who makes over $5k/month in passive income on her best career advice,bofa says this 'best-in-class' electric vehicle charging stock could surge 65%,"tylenol parent kenvue can capitalize on consumer self-care trends, jpmorgan says",drone attack hits moscow buildings; kyiv endures third russian bombardment in 24 hours,5 things to know before the stock market opens tuesday,atlantic equities says coinbase is the 'best expression of crypto',bitcoin rises as investors await vote on tentative debt ceiling agreement,stablecoin giant tether to mine bitcoin in uruguay using renewable energy,jim cramer's top 10 things to watch in the stock market tuesday,,,,
bernstein gives an under-the-radar way to play the transition to clean energy,damar hamlin on how he made the decision to play football in the nfl again,why this chip stock could be the next nvidia,schwarzenegger: 'no one gives a s--- about' climate change  rebrand the effort,debt limit bill would speed completion of west virginia gas pipeline,"market focus will shift back to earnings, says fundstrat's tom lee",theranos founder elizabeth holmes reports to prison to begin sentence,"stocks making the biggest moves midday: nvidia, tesla, coinbase and more",,,,,,,,,,,,,,,,,,,,,,,,,,
schwarzenegger: 'no one gives a s--- about' climate change  rebrand the effort,what is next with debt deal? wall street economists on bumps in the road ahead,,,,,,,,,,,,,,,,,,,,,,,,,,,,,,,,
"nvidia's ascent continues, while citi says buy j&j. here's our take on the news",goldman sachs is cutting jobs again amid wall street deals slump,tim scott pushes bill that would require disclosure of apps' country of origin,proposed debt ceiling deal would cut part of $80 billion irs funding,these companies are buying back their shares without using too much debt,chatgpt cited 'bogus' cases for a new york federal court filing,schwarzenegger: 'no one gives a s--- about' climate change  rebrand the effort
nvidia crosses into $1 trillion market cap before giving back gains,2023-05-30 15:25:00
what damar hamlin thinks about fear and his decision to return to the nfl,2023-05-30 15:25:00
top 5 trending summer travel destinations 2023florida didn't make the list,coinbase stock pops after analyst upgrade. heres how the pros are reacting,how damar hamlin thinks about fear and his decision to return to the nfl
"stocks making the biggest moves after hours: ambarella, box, hp and more","debt ceiling bill poised to clear key house committee, teeing up final vote"
stock futures are little changed as traders await debt ceiling progress in washington: live updates
