22.0,defense spending levels threaten to delay senate plan to fasttrack debt ceiling bill,"start teaching kids money, according experts","Buy Buy Baby draws sale interest Bed Bath & Beyond bankruptcy, one bidder looks save stores","start teaching kids money, according experts","Payrolls rose 339,000 May, much better expected resilient labor market",Jim Cramer's top 10 things watch stock market Friday,Nvidia’s rise changed biggest momentum ETF,Google says Gmail phone got lot faster thanks A.I.,Google says Gmail phone got lot faster thanks A.I.,News potential Beijing stimulus boosts Club's China-exposed names,Three cruise stocks among week's best performers summer approaches,"Stocks making biggest moves midday: Lululemon, SentinelOne",West Coast ports shut union workers walk job wages,Nvidia’s rise changed biggest momentum ETF,Arizona sets limits construction around Phoenix groundwater dwindles,"Treasury yields rise investors weigh interest rate outlook, key economic data",Universal basic income could coming U.K. — here's,World Bank betting company 'green' $1.6 trillion steel industry,SEC sues Binance CEO Changpeng Zhao U.S. securities violations,RFK Jr.'s presidential bid gains boost Silicon Valley elite
23.0,money stored in payment apps such as venmo may be more vulnerable cfpb says,Atlantic Equities downgrades music stock A.I. threatens revenue growth,"Buy Broadcom thanks undervalued AI portfolio, BofA says",Atlantic Equities downgrades music stock A.I. threatens revenue growth,"Friday's top analyst calls: Apple, Amazon, Broadcom, Bowlero, Microsoft, Rivian",1 3 parents worries taking advantage flexible work hurt careers,Unemployment dropped among Hispanic men women May,Telecom stocks fall report Amazon considers launching Prime wireless service,Telecom stocks fall report Amazon considers launching Prime wireless service,"Even inflation rate subsides, prices may stay higher. Here's",Harvard nutritionist: 4 toxic food ingredients 'actually make hungrier'—what eat instead,West Coast ports shut union workers walk job wages,FDA allows import unapproved Chinese chemotherapy drug ease U.S. shortage,Here’s jobs May 2023 — one chart,"Stocks making biggest moves midday: Lululemon, SentinelOne",World Bank betting company 'green' $1.6 trillion steel industry,JPMorgan upgrades bank limited exposure commercial real estate,Italy bargain vacationing Americans. much Italians,"Stocks making biggest moves premarket: Palo Alto Networks, Apple, Target",Cramer urges patience: 'It make lot sense get run'
24.0,get ready to sell nasdaq stocks according to wall street seasonal theory,JPMorgan downgrades electric utility stock rising regulatory risks,5 things know stock market opens Friday,JPMorgan downgrades electric utility stock rising regulatory risks,"Stocks making biggest moves premarket: SentinelOne, Lululemon, Dupont",Harvard nutritionist: 4 toxic food ingredients 'actually make hungrier'—what eat instead,93% CEOs preparing recession—what means,"23-year-old's ice cream empire brings $650,000 year—here's","23-year-old's ice cream empire brings $650,000 year—here's","States sue 3M, DuPont toxic 'forever chemicals' found drinking water",1 3 parents worries taking advantage flexible work hurt careers,"Morgan Stanley: Apple unveil $20 billion platform, ups price target",News potential Beijing stimulus boosts Club's China-exposed names,"bull case Saudi Arabia stocks growing, risks remain","Morgan Stanley: Apple unveil $20 billion platform, ups price target",GM invest $1 billion produce new heavy-duty pickups,"Stocks making biggest moves premarket: Palo Alto Networks, Apple, Target","Monday's top analyst calls: Apple, Tesla, Meta, Micron, Bowlero, Nike, Disney",JPMorgan upgrades bank limited exposure commercial real estate,Apple shares pace record high ahead VR headset unveiling
25.0,heres what earnings from industry rivals mean for two club names,Telecom stocks fall report Amazon considers launching mobile service Prime members,OPEC+ prepares weekend meeting Saudi warns speculators 'watch out',Telecom stocks fall report Amazon considers launching mobile service Prime members,Consumers likely cut back restaurant visits trade,"Dow soars 700 points strong jobs report, stocks head winning week","States sue 3M, DuPont toxic 'forever chemicals' found drinking water",Atlantic Equities downgrades music stock A.I. threatens revenue growth,Atlantic Equities downgrades music stock A.I. threatens revenue growth,Arizona sets limits construction around Phoenix groundwater dwindles,Atlantic Equities downgrades music stock A.I. threatens revenue growth,1 3 parents worries taking advantage flexible work hurt careers,Google says Gmail phone got lot faster thanks A.I.,Lululemon shares surge earnings beat. play stock,Tech stocks close first six-week rally since January 2020,Jim Cramer's top 10 things watch stock market Monday,"Watch natural gas stock 50% upside, Morgan Stanley says",Democrats warn Musk Twitter safety execs leave,RFK Jr.'s presidential bid gains boost Silicon Valley elite,"Stock markets ignoring 'laundry list' risks, strategist says"
26.0,these jobsrelated names are underperforming  and could signal a slowdown ahead,Harvard nutritionist: 4 toxic food ingredients 'actually make hungrier'—what eat instead,Atlantic Equities downgrades music stock A.I. threatens revenue growth,Harvard nutritionist: 4 toxic food ingredients 'actually make hungrier'—what eat instead,"Traders betting short-term reversal chip stocks, ETF flows show",93% CEOs preparing recession—what means,Atlantic Equities downgrades music stock A.I. threatens revenue growth,Harvard nutritionist: 4 toxic food ingredients 'actually make hungrier'—what eat instead,Harvard nutritionist: 4 toxic food ingredients 'actually make hungrier'—what eat instead,Telecom stocks fall report Amazon considers launching mobile service Prime members,Unemployment dropped among Hispanic men women May,Atlantic Equities downgrades music stock A.I. threatens revenue growth,"SUNY sends college acceptance letters 125,000 high school seniors","Dow leaps 700 points hot jobs report, Nasdaq notches sixth straight winning week",Unemployment dropped among Hispanic men women May,Moderna vaccine used Keytruda reduces risk deadly skin cancer spreading,Air travel disrupted 'very frustrating' supply chain issues: IATA,JPMorgan upgrades bank limited exposure commercial real estate,"Monday's top analyst calls: Apple, Tesla, Meta, Micron, Bowlero, Nike, Disney",new lithium extraction tech could help us meet electric vehicle targets
27.0,why apples vr headset could succeed where every similar product has failed,Consumers keep traveling despite recession fears inflation,"Stocks making biggest moves premarket: SentinelOne, Lululemon, Dupont",Consumers keep traveling despite recession fears inflation,Europe stocks climb U.S. debt ceiling deal; Swedish property group SBB soars 30%,"SUNY sends college acceptance letters 125,000 high school seniors","Dow soars 700 points, heads best day 2023",Telecom stocks fall report Amazon considers launching mobile service Prime members,Telecom stocks fall report Amazon considers launching mobile service Prime members,Three cruise stocks among week's best performers summer approaches,Buy Buy Baby draws sale interest Bed Bath & Beyond bankruptcy,"Traders betting short-term reversal chip stocks, ETF flows show",Pence charged DOJ probe classified documents found home,Questions markets next week center Fed derailment skinny rally,Crypto bill Republicans lays clear roles SEC CFTC,U.S. China trade barbs top security summit Taiwan Strait tensions simmer,Italy bargain vacationing Americans. much Italians,stock market advance depends rally broadening,Italy bargain vacationing Americans. much Italians,Mike Pence files paperwork launch 2024 Republican presidential campaign
28.0,cnns new coo underscores bond between ceo chris licht and wbd boss david zaslav,Europe stocks climb U.S. debt ceiling deal; Swedish property group SBB soars 30%,"Payrolls rose 339,000 May, much better expected resilient labor market",Europe stocks climb U.S. debt ceiling deal; Swedish property group SBB soars 30%,"Even inflation rate subsides, prices may stay higher. Here's",Atlantic Equities downgrades music stock A.I. threatens revenue growth,Arizona sets limits construction around Phoenix groundwater dwindles,News potential Beijing stimulus boosts Club's China-exposed names,News potential Beijing stimulus boosts Club's China-exposed names,Bank America highlights 7 stocks behind year's market gains,Telecom stocks fall report Amazon considers launching mobile service Prime members,Psychologist: 3 ways deal power-hungry co-worker,"bull case Saudi Arabia stocks growing, risks remain",Pence charged DOJ probe classified documents found home,Psychologist: 3 ways deal power-hungry co-worker,CNBC Daily Open: Goldilocks jobs market?,"Citi upgrades Ford buy, sees nearly 30% upside auto sales outlook improves",5 things know stock market opens Monday,"Watch natural gas stock 50% upside, Morgan Stanley says",GM invest $1 billion produce new heavy-duty pickups
29.0,barack obama what the most successful people do differently in their careers,OPEC+ prepares weekend meeting Saudi warns speculators 'watch out',"'Everyone see reality' Ukraine except Putin, UK defense minister says",OPEC+ prepares weekend meeting Saudi warns speculators 'watch out',Telecom stocks fall report Amazon considers launching Prime wireless service,Google says Gmail phone got lot faster thanks A.I.,"Morgan Stanley: Apple unveil $20 billion platform, ups price target","Stocks making biggest moves midday: Lululemon, SentinelOne","Stocks making biggest moves midday: Lululemon, SentinelOne",YouTube stop removing false claims 2020 election fraud,"Diamond Sports must pay four MLB teams full, bankruptcy judge says","bull case Saudi Arabia stocks growing, risks remain",Bank America highlights 7 stocks behind year's market gains,Bank America highlights 7 stocks behind year's market gains,"bull case Saudi Arabia stocks growing, risks remain","Ivy League acceptance rates 'may bottomed out,' expert says","Monday's top analyst calls: Apple, Tesla, Meta, Micron, Bowlero, Nike, Disney","Spotify lays 200 employees, 2% workforce","Citi upgrades Ford buy, sees nearly 30% upside auto sales outlook improves","Monday's top analyst calls: Apple, Tesla, Meta, Micron, Bowlero, Nike, Disney"
30.0,fda mulls cancer drug imports from unapproved companies to ease chemo shortage,"Payrolls rose 339,000 May, much better expected resilient labor market",Europe stocks climb U.S. debt ceiling deal; Swedish property group SBB soars 30%,"Payrolls rose 339,000 May, much better expected resilient labor market","Wall Street rally gains steam, Dow surges 500 points strong jobs report","wealthy Americans love UBS, secretive Swiss banking giant","SUNY sends college acceptance letters 125,000 high school seniors",Arizona sets limits construction around Phoenix groundwater dwindles,Arizona sets limits construction around Phoenix groundwater dwindles,Google says Gmail phone got lot faster thanks A.I.,93% CEOs preparing recession—what means,Google says Gmail phone got lot faster thanks A.I.,Three cruise stocks among week's best performers summer approaches,FDA allows import unapproved Chinese chemotherapy drug ease U.S. shortage,Here's first-quarter earnings report card every stock portfolio,Italy bargain vacationing Americans. much Italians,5 things know stock market opens Monday,Universal basic income could coming U.K. — here's,Jim Cramer's top 10 things watch stock market Monday,"Ivy League acceptance rates 'may bottomed out,' expert says"
31.0,reddit will charge hefty fees to millions of thirdparty apps that access its data,Treasury yields hold steady Senate passes debt ceiling bill,Telecom stocks fall report Amazon considers launching mobile service Prime members,Treasury yields hold steady Senate passes debt ceiling bill,Jim Cramer's top 10 things watch stock market Friday,Nvidia’s rise changed biggest momentum ETF,Pence charged DOJ probe classified documents found home,93% CEOs preparing recession—what means,93% CEOs preparing recession—what means,Buy Buy Baby draws sale interest Bed Bath & Beyond bankruptcy,Nvidia’s rise changed biggest momentum ETF,Unemployment dropped among Hispanic men women May,Unemployment dropped among Hispanic men women May,Google says Gmail phone got lot faster thanks A.I.,Lululemon shares surge earnings beat. play stock,"Oppenheimer downgrades Estee Lauder, says gains harder come",Morgan Stanley downgrades Dollar General,"Stocks making biggest moves premarket: Palo Alto Networks, Apple, Target",new lithium extraction tech could help us meet electric vehicle targets,"We're locking huge gain one stock, plus catalyst hits"
32.0,heres how to buy treasury bills as yields top 5,"Buy Buy Baby draws sale interest Bed Bath & Beyond bankruptcy, one bidder looks save stores",Here’s jobs May 2023 — one chart,"Buy Buy Baby draws sale interest Bed Bath & Beyond bankruptcy, one bidder looks save stores",Harvard nutritionist: 4 toxic food ingredients 'actually make hungrier'—what eat instead,Three cruise stocks among week's best performers summer approaches,"Diamond Sports must pay four MLB teams full, bankruptcy judge says",Bank America highlights 7 stocks behind year's market gains,Bank America highlights 7 stocks behind year's market gains,1 3 parents worries taking advantage flexible work hurt careers,"bull case Saudi Arabia stocks growing, risks remain","wealthy Americans love UBS, secretive Swiss banking giant",Crypto bill Republicans lays clear roles SEC CFTC,93% CEOs preparing recession—what means,Bank America highlights 7 stocks behind year's market gains,Formula One rally nearly 40% thanks favorable commercial rights deal,Apple hits record high ahead VR headset unveiling,24-year-old negotiated first job offer email—and got $33K,"Spotify lays 200 employees, 2% workforce",Universal basic income could coming U.K. — here's
,,"Bitcoin posted worst month since November, network activity saw record highs",Costco $1.50 hot dog—4 products beaten inflation,"Bitcoin posted worst month since November, network activity saw record highs",Billionaire Tom Siebel faces mounting controversy A.I. software vendor C3.ai,"Diamond Sports must pay four MLB teams full, bankruptcy judge says","Even inflation rate subsides, prices may stay higher. Here's","Bitcoin posted worst month since November, network activity saw record highs","Bitcoin posted worst month since November, network activity saw record highs","Morgan Stanley: Apple unveil $20 billion platform, ups price target",Pence charged DOJ probe classified documents found home,FDA allows import unapproved Chinese chemotherapy drug ease U.S. shortage,Lululemon shares surge earnings beat. play stock,"SUNY sends college acceptance letters 125,000 high school seniors",,"Stocks making biggest moves premarket: Palo Alto Networks, Apple, Target",Apple shares pace record high ahead VR headset unveiling,Apple hits record high ahead VR headset unveiling,S&P 500 rises fresh 9-month high led Apple,
