Unnamed: 0,2023-06-01 15:41:56,2023-06-02 09:59:05,2023-06-02 10:03:45,2023-06-02 10:05:01
1.0,medicare details plan to cover alzheimers treatments,,,
2.0,salesforce tumbles despite strong earnings heres what the pros say,"Buy ad stock jump 20%, Morgan Stanley says",Harvard nutritionist: 4 toxic food ingredients 'actually make hungrier'—what eat instead,"Buy ad stock jump 20%, Morgan Stanley says"
3.0,microsoft signs deal with nvidiabacked coreweave to meet ai computing demand,Consumers likely cut back restaurant visits trade,JPMorgan downgrades electric utility stock rising regulatory risks,Consumers likely cut back restaurant visits trade
4.0,amazons north america fulfillment head is leaving,"Even inflation rate subsides, prices may stay higher. Here's","start teaching kids money, according experts","Even inflation rate subsides, prices may stay higher. Here's"
5.0,stocks making the biggest moves midday dollar general c3ai chewy and more,Billionaire Tom Siebel faces mounting controversy A.I. software vendor C3.ai,"Traders betting short-term reversal chip stocks, ETF flows show",Billionaire Tom Siebel faces mounting controversy A.I. software vendor C3.ai
6.0,lululemon shares surge after reporting sales growth raising fullyear guidance,Buy Buy Baby draws sale interest Bed Bath & Beyond bankruptcy,Buy Buy Baby draws sale interest Bed Bath & Beyond bankruptcy,Buy Buy Baby draws sale interest Bed Bath & Beyond bankruptcy
7.0,heres why diddy is suing diageo over his vodka and tequila brands,"Buy Broadcom thanks undervalued AI portfolio, BofA says",manage big retirement risk amid health-care inflation,"Buy Broadcom thanks undervalued AI portfolio, BofA says"
8.0,retail investors start to join stock market rally data shows,Jim Cramer's top 10 things watch stock market Friday,"Even inflation rate subsides, prices may stay higher. Here's",Jim Cramer's top 10 things watch stock market Friday
9.0,senate votes to repeal bidens student loan forgiveness plan,5 things know stock market opens Friday,Jim Cramer's top 10 things watch stock market Friday,5 things know stock market opens Friday
10.0,kids who live with pets may be less prone to food allergies a new study shows,Costco $1.50 hot dog—4 products beaten inflation,Here's price beer changed time,Costco $1.50 hot dog—4 products beaten inflation
11.0,lululemon shares surge after reporting 24 sales growth raising fullyear guidance,"'Everyone see reality' Ukraine except Putin, UK defense minister says","Buy ad stock jump 20%, Morgan Stanley says","'Everyone see reality' Ukraine except Putin, UK defense minister says"
12.0,heres what to watch out for in fridays jobs report for may,Here's price beer changed time,Treasury yields hold steady Senate passes debt ceiling bill,Here's price beer changed time
13.0,donald trump plans 2024 fundraising swing from georgia to his nj golf course,Twitter trust safety chief Ella Irwin resigns,"Bitcoin posted worst month since November, network activity saw record highs",Twitter trust safety chief Ella Irwin resigns
14.0,actor mark wahlberg lobbies to make las vegas a hollywood in the desert,Here’s jobs May 2023 — one chart,Billionaire Tom Siebel faces mounting controversy A.I. software vendor C3.ai,Here’s jobs May 2023 — one chart
15.0,why do some companies have weird fiscal years that dont align with the calendar,"Traders betting short-term reversal chip stocks, ETF flows show","JPMorgan raises 2024 GDP forecast India, says headwinds remain","Traders betting short-term reversal chip stocks, ETF flows show"
16.0,uber crowded trades from professional investors are crushing the market,"JPMorgan raises 2024 GDP forecast India, says headwinds remain",Consumers likely cut back restaurant visits trade,"JPMorgan raises 2024 GDP forecast India, says headwinds remain"
17.0,pentagon awards spacex with ukraine contract for starlink satellite internet,manage big retirement risk amid health-care inflation,Telecom stocks fall report Amazon considers launching Prime wireless service,manage big retirement risk amid health-care inflation
18.0,why iran keeps seizing oil tankers in the strait of hormuz,"Friday's top analyst calls: Apple, Amazon, Broadcom, Bowlero, Microsoft, Rivian",Twitter trust safety chief Ella Irwin resigns,"Friday's top analyst calls: Apple, Amazon, Broadcom, Bowlero, Microsoft, Rivian"
19.0,fortinet and more cnbcs halftime report traders answer your questions,Zelenskyy ramps pressure NATO membership; Russia says border villages shelled,Zelenskyy ramps pressure NATO membership; Russia says border villages shelled,Zelenskyy ramps pressure NATO membership; Russia says border villages shelled
20.0,nyus damodaran says he sold half his nvidia stake for one simple reason,"Stocks making biggest moves premarket: SentinelOne, Lululemon, Dupont",Consumers keep traveling despite recession fears inflation,"Stocks making biggest moves premarket: SentinelOne, Lululemon, Dupont"
21.0,were encouraged by positive developments around two stocks that we really like,Telecom stocks fall report Amazon considers launching Prime wireless service,"Friday's top analyst calls: Apple, Amazon, Broadcom, Bowlero, Microsoft, Rivian",Telecom stocks fall report Amazon considers launching Prime wireless service
22.0,defense spending levels threaten to delay senate plan to fasttrack debt ceiling bill,"start teaching kids money, according experts","Buy Buy Baby draws sale interest Bed Bath & Beyond bankruptcy, one bidder looks save stores","start teaching kids money, according experts"
23.0,money stored in payment apps such as venmo may be more vulnerable cfpb says,Atlantic Equities downgrades music stock A.I. threatens revenue growth,"Buy Broadcom thanks undervalued AI portfolio, BofA says",Atlantic Equities downgrades music stock A.I. threatens revenue growth
24.0,get ready to sell nasdaq stocks according to wall street seasonal theory,JPMorgan downgrades electric utility stock rising regulatory risks,5 things know stock market opens Friday,JPMorgan downgrades electric utility stock rising regulatory risks
25.0,heres what earnings from industry rivals mean for two club names,Telecom stocks fall report Amazon considers launching mobile service Prime members,OPEC+ prepares weekend meeting Saudi warns speculators 'watch out',Telecom stocks fall report Amazon considers launching mobile service Prime members
26.0,these jobsrelated names are underperforming  and could signal a slowdown ahead,Harvard nutritionist: 4 toxic food ingredients 'actually make hungrier'—what eat instead,Atlantic Equities downgrades music stock A.I. threatens revenue growth,Harvard nutritionist: 4 toxic food ingredients 'actually make hungrier'—what eat instead
27.0,why apples vr headset could succeed where every similar product has failed,Consumers keep traveling despite recession fears inflation,"Stocks making biggest moves premarket: SentinelOne, Lululemon, Dupont",Consumers keep traveling despite recession fears inflation
28.0,cnns new coo underscores bond between ceo chris licht and wbd boss david zaslav,Europe stocks climb U.S. debt ceiling deal; Swedish property group SBB soars 30%,"Payrolls rose 339,000 May, much better expected resilient labor market",Europe stocks climb U.S. debt ceiling deal; Swedish property group SBB soars 30%
29.0,barack obama what the most successful people do differently in their careers,OPEC+ prepares weekend meeting Saudi warns speculators 'watch out',"'Everyone see reality' Ukraine except Putin, UK defense minister says",OPEC+ prepares weekend meeting Saudi warns speculators 'watch out'
30.0,fda mulls cancer drug imports from unapproved companies to ease chemo shortage,"Payrolls rose 339,000 May, much better expected resilient labor market",Europe stocks climb U.S. debt ceiling deal; Swedish property group SBB soars 30%,"Payrolls rose 339,000 May, much better expected resilient labor market"
31.0,reddit will charge hefty fees to millions of thirdparty apps that access its data,Treasury yields hold steady Senate passes debt ceiling bill,Telecom stocks fall report Amazon considers launching mobile service Prime members,Treasury yields hold steady Senate passes debt ceiling bill
32.0,heres how to buy treasury bills as yields top 5,"Buy Buy Baby draws sale interest Bed Bath & Beyond bankruptcy, one bidder looks save stores",Here’s jobs May 2023 — one chart,"Buy Buy Baby draws sale interest Bed Bath & Beyond bankruptcy, one bidder looks save stores"
,,"Bitcoin posted worst month since November, network activity saw record highs",Costco $1.50 hot dog—4 products beaten inflation,"Bitcoin posted worst month since November, network activity saw record highs"
